url,headline,about,match,reason,score
"https://www.linkedin.com/sales/lead/ACwAAAFzD4ABw2Qhhy-aDGqyh0-UTJ28MNmTCBc,NAME_SEARCH,I2-L?_ntb=kR4%2F%2BrcRQn%2B9HXVY8eVhjQ%3D%3D",CEO | Global Industry Leader in Operational Excellence | Computer Scientist & AI Expert | Former Professional Tennis Player --- Strategy. Technology. Leadership. International Impact.,"For more than a decade, I’ve had the opportunity to lead from the front as CEO - across borders, industries, and complex challenges.
From revitalizing underperforming production sites in Germany and abroad to building what became the world’s largest aluminum tube manufacturing plant, I’ve consistently turned potential into performance.
My journey has taken me through medium-sized enterprises, global corporations, and consultancy, where I’ve led strategic transformations and built operations that have become benchmarks in the packaging industry for the food and pharmaceutical sectors. Along the way, I’ve cultivated long-term partnerships with top-tier “A” clients and secured double-digit million-euro grants across multiple countries, ensuring both growth and stability.
What sets me apart is a deep understanding of complexity paired with clear strategic foresight, a sharp focus on outcomes, and a consistent drive for operational excellence. I bring the resilience to lead through uncertainty, a strong sense of direction, and a commitment to continuous learning and collaboration—always with the goal of delivering lasting value and helping shape a sustainable, secure, and forward-looking future.


Seit über zehn Jahren übernehme ich als CEO Verantwortung an vorderster Front – über Ländergrenzen, Branchen und komplexe Herausforderungen hinweg.
Von der Restrukturierung schwacher Produktionsstandorte in Deutschland und im Ausland bis zum Aufbau des weltweit größten Werks für Aluminiumtuben habe ich Potenziale konsequent in nachhaltige Leistung überführt.
Mein Weg führte durch mittelständische Unternehmen, internationale Konzerne und die Beratung. Dabei habe ich strategische Transformationen geleitet und Strukturen geschaffen, die heute als Maßstab in der Verpackungsindustrie für Lebensmittel und Pharma gelten.
Ich habe langfristige Partnerschaften mit strategisch wichtigen A-Kunden aufgebaut und länderübergreifend Förderungen im zweistelligen Millionenbereich gesichert - und damit Stabilität und Weiterentwicklung ermöglicht.
Was mich auszeichnet, ist ein tiefes Verständnis für komplexe Zusammenhänge, strategische Weitsicht, Ergebnisorientierung und der Anspruch an operative Exzellenz. Ich führe mit Resilienz, klarem Fokus, Lernbereitschaft und einem kooperativen Führungsstil – mit dem Ziel, nachhaltige Werte zu schaffen um die Zukunft aktiv mitzugestalten.
Show less",YES,"The profile has a strong background in operational excellence, strategic transformations, and has led operations in the packaging industry for the food and pharmaceutical sectors. This aligns with the target client's needs in industrial, automotive, pharma/medical devices, construction, furniture/wood coating, and industrial automation sectors. However, the profile does not specifically mention experience with the detailed equipment and systems listed in the target client description.",0.7
"https://www.linkedin.com/sales/lead/ACwAAAFF5R0BnguYZG2CZrI3ajWV9NdT746zMtc,NAME_SEARCH,SJvl?_ntb=kR4%2F%2BrcRQn%2B9HXVY8eVhjQ%3D%3D",CEO & Co-Founder at Keylika | YC S22,- Founded a biopharma startup (Keylika Inc.) to develop small molecule therapeutics and optimized drug delivery technologies to effect the best clinical outcomes. Keylika is developing the world's first prescription patch for treating iron deficiency … Show more,YES,"The profile aligns with the target client description in the Pharma/Medical Devices sector. The profile mentions that they are developing drug delivery technologies, which could potentially include systems like sterile adhesive dispensing systems, cartridge filling machines, precise micro dosing dispensers, and syringe filling machines.",0.7
"https://www.linkedin.com/sales/lead/ACwAAAL89qgBZHchr-jF7sXJoc2d1n0Oc44g57I,NAME_SEARCH,FEgx?_ntb=kR4%2F%2BrcRQn%2B9HXVY8eVhjQ%3D%3D","Founder, Chairman & CEO Foxx Life Sciences - Please Hit Follow - LinkedIn limits connections to 30,000","Foxx Life Sciences is a global leader in Standard and Custom Single Use Systems (SUS) for Pharmaceutical and Biologics production, Tubing, Connectors, Gaskets, Pharma Hoses, Stainless Steel, Laboratory and Process Filtration, Fluid Management, Laboratory Safety, Labware & Glassware.

Show less",YES,"The profile of Foxx Life Sciences aligns with the target client description in the Pharma/Medical Devices sector. They are a global leader in Single Use Systems (SUS) for Pharmaceutical and Biologics production, which could potentially include systems for sterile adhesive dispensing, cartridge filling, precise micro dosing, and syringe filling. However, there is no explicit mention of the specific keywords listed in the target client description.",0.6
